{
  "$schema": "http://json-schema.org/draft-07/schema#",
  "$id": "https://github.com/bigeasyfreeman/adlc/blob/main/docs/schemas/completion-audit-report.schema.json",
  "title": "ADLC Completion Audit Report",
  "type": "object",
  "additionalProperties": false,
  "required": ["contract_version", "status", "auditor", "verified", "taken_on_trust", "findings", "feedback_findings"],
  "properties": {
    "contract_version": {"type": "string"},
    "status": {"type": "string", "enum": ["pass", "blocked"]},
    "executor": {"type": "string", "minLength": 1},
    "auditor": {"type": "string", "minLength": 1},
    "independence": {
      "type": "object",
      "additionalProperties": false,
      "required": ["basis", "executor_session_id", "auditor_session_id", "evidence_path", "evidence_sha256", "evidence_refs"],
      "properties": {
        "basis": {"type": "string", "enum": ["separate_agent", "separate_session", "external_reviewer"]},
        "executor_session_id": {"type": "string", "minLength": 1},
        "auditor_session_id": {"type": "string", "minLength": 1},
        "evidence_path": {"type": "string", "minLength": 1},
        "evidence_sha256": {"type": "string", "pattern": "^[a-f0-9]{64}$"},
        "evidence_refs": {"type": "array", "minItems": 1, "items": {"type": "string", "minLength": 1}}
      }
    },
    "verified": {"type": "array", "items": {"type": "object"}},
    "taken_on_trust": {"type": "array", "items": {"type": "object"}},
    "findings": {"type": "array", "items": {"type": "object"}},
    "feedback_findings": {"type": "array", "items": {"type": "object"}}
  }
}
