{
  "auditor": "live-codex-fix-auditor",
  "contract_version": "1.0.0",
  "executor": "live-codex-fix-executor",
  "feedback_findings": [],
  "findings": [],
  "independence": {
    "auditor_session_id": "019f649c-6709-7971-a50e-8d2bfdf65cb8",
    "basis": "separate_session",
    "evidence_path": "<TEMP>/independence.json",
    "evidence_refs": [
      "runs/run-002/interrupted.json",
      "runs/run-002/review.json"
    ],
    "evidence_sha256": "4bc5b45857e4569f3360996201de46c338e3a9d8cb5876ea6f40fc0a37a9b480",
    "executor_session_id": "019f649a-2c69-76a0-8ace-0fd603d713ea"
  },
  "status": "pass",
  "taken_on_trust": [],
  "verified": [
    {
      "claim": "The invoice verifier passes after the live Codex fix.",
      "id": "FIX-GREEN",
      "observed": {
        "actual_exit": 0,
        "command": "python3 -m unittest discover -s tests -v",
        "expected_exit": 0,
        "stderr": "test_allocations_reconcile_rounding_remainder (test_invoice.AllocateDiscountTests) ... ok\ntest_empty_invoice_rejects_nonzero_discount (test_invoice.AllocateDiscountTests) ... ok\ntest_preserves_proportional_allocation_without_remainder (test_invoice.AllocateDiscountTests) ... ok\ntest_reconciles_uneven_lines_with_stable_largest_remainder (test_invoice.AllocateDiscountTests) ... ok\ntest_rejects_negative_money (test_invoice.AllocateDiscountTests) ... ok\ntest_zero_total_returns_cent_precision_zeroes (test_invoice.AllocateDiscountTests) ... ok\n\n----------------------------------------------------------------------\nRan 6 tests in 0.000s\n\nOK\n",
        "stdout": ""
      }
    },
    {
      "claim": "The target worktree is clean and PR-ready.",
      "id": "FIX-PR-READY",
      "observed": {
        "actual_exit": 0,
        "command": "test -z \"$(git status --porcelain --untracked-files=all)\"",
        "expected_exit": 0,
        "stderr": "",
        "stdout": ""
      }
    }
  ]
}
