{
  "auditor": "independent",
  "contract_version": "1.0.0",
  "feedback_findings": [],
  "findings": [],
  "status": "pass",
  "taken_on_trust": [],
  "verified": [
    {
      "claim": "The operator-side coverage self-run Build Brief is schema-valid.",
      "id": "build-brief-valid",
      "observed": {
        "errors": [],
        "path": "/Users/eric/adlc-main/docs/build-briefs/operator-side-coverage.json",
        "schema": "build-brief"
      }
    },
    {
      "claim": "Every acceptance criterion in the self-run Build Brief has a schema-valid depth declaration.",
      "id": "criterion-depth-valid",
      "observed": {
        "errors": [],
        "path": "/Users/eric/adlc-main/docs/tests/operator-side-coverage/criterion-depth-report.json",
        "schema": "criterion-depth-report"
      }
    },
    {
      "claim": "The self-run clarity gate report passes with no remaining unknowns.",
      "id": "clarity-pass",
      "observed": {
        "actual_exit": 0,
        "command": "jq -e '.status == \"pass\" and (.honesty_surface.remaining_unknowns | length) == 0' docs/tests/operator-side-coverage/clarity-gate-report.json",
        "expected_exit": 0,
        "stderr": "",
        "stdout": "true\n"
      }
    },
    {
      "claim": "The self-run minimalism audit report passes and checked the predicate library.",
      "id": "minimalism-pass",
      "observed": {
        "actual_exit": 0,
        "command": "jq -e '.status == \"pass\" and (.checked_rule_ids | length) > 0 and (.findings | length) == 0' docs/tests/operator-side-coverage/minimalism-audit-report.json",
        "expected_exit": 0,
        "stderr": "",
        "stdout": "true\n"
      }
    },
    {
      "claim": "The CLI suite contains deterministic dry-run coverage for OPR-1 through OPR-4 and the no-nag inactive path.",
      "id": "operator-dry-runs-covered",
      "observed": {
        "actual_exit": 0,
        "command": "for pattern in 'OPR-1 divergence blocks missing artifact' 'OPR-2 volatility renderer orders data-model decisions' 'OPR-3 operator comprehension blocks missing' 'OPR-4 teach-first blocks without criteria' 'OPR no-nag inactive path records not_applicable'; do rg -q \"$pattern\" tests/test_adlc_cli.sh || exit 1; done",
        "expected_exit": 0,
        "stderr": "",
        "stdout": ""
      }
    },
    {
      "claim": "The README harness loop documents the four inherited operator-side gates.",
      "id": "readme-operator-loop-covered",
      "observed": {
        "actual_exit": 0,
        "command": "for pattern in 'operator-divergence-gate' 'volatility-review' 'teach-first-gate' 'operator-comprehension-gate'; do rg -q \"$pattern\" README.md || exit 1; done",
        "expected_exit": 0,
        "stderr": "",
        "stdout": ""
      }
    },
    {
      "claim": "The full canonical ADLC CI suite passes after the operator-side coverage implementation.",
      "id": "canonical-ci-pass",
      "observed": {
        "actual_exit": 0,
        "command": "bin/adlc ci --json | jq -e '.status == \"pass\" and all(.suites[]; .status == \"pass\")'",
        "expected_exit": 0,
        "stderr": "",
        "stdout": "true\n"
      }
    }
  ]
}
